{
  "metadata": {
    "name": "Default Theme",
    "organizationName": "Your Organization",
    "description": "Default theme configuration - customize this for your survey"
  },
  "colors": {
    "primary": "#0055A5",
    "secondary": "#B2BB1C",
    "background": "#FFF8F1",
    "surface": "#FFFFFF",
    "surfaceAlt": "#FFF5EB",
    "accent": {
      "coral": "#FF6B6B",
      "purple": "#845EC2",
      "teal": "#4ECDC4",
      "yellow": "#FFE66D",
      "pink": "#FF6F91"
    },
    "text": {
      "primary": "#1A1A2E",
      "secondary": "#4A5568",
      "light": "#718096",
      "inverse": "#FFFFFF"
    },
    "border": "#E2E8F0",
    "borderLight": "#F0F4F8",
    "error": "#E53E3E",
    "success": "#48BB78",
    "warning": "#ED8936",
    "chatBubble": {
      "bot": "#FFFFFF",
      "botText": "#1A1A2E",
      "user": "linear-gradient(135deg, #0055A5 0%, #003d7a 100%)",
      "userText": "#FFFFFF"
    },
    "gradients": {
      "primary": "linear-gradient(135deg, #0055A5 0%, #003d7a 100%)",
      "secondary": "linear-gradient(135deg, #B2BB1C 0%, #8fa117 100%)",
      "artistic": "linear-gradient(135deg, #667eea 0%, #764ba2 100%)",
      "sunset": "linear-gradient(135deg, #FF6B6B 0%, #FFE66D 100%)",
      "ocean": "linear-gradient(135deg, #4ECDC4 0%, #44A08D 100%)"
    }
  },
  "fonts": {
    "primary": "'Inter', -apple-system, BlinkMacSystemFont, 'Segoe UI', Roboto, sans-serif",
    "display": "'Poppins', 'Inter', sans-serif"
  },
  "assets": {
    "logo": "/assets/logo.png",
    "favicon": "/assets/favicon.ico"
  },
  "spacing": {
    "xs": "0.25rem",
    "sm": "0.5rem",
    "md": "1rem",
    "lg": "1.5rem",
    "xl": "2rem",
    "2xl": "3rem",
    "3xl": "4rem",
    "4xl": "5rem"
  },
  "borderRadius": {
    "sm": "0.375rem",
    "md": "0.5rem",
    "lg": "1rem",
    "xl": "1.5rem",
    "2xl": "2rem",
    "full": "9999px"
  },
  "shadows": {
    "sm": "0 1px 3px 0 rgba(0, 0, 0, 0.1), 0 1px 2px 0 rgba(0, 0, 0, 0.06)",
    "md": "0 4px 6px -1px rgba(0, 0, 0, 0.1), 0 2px 4px -1px rgba(0, 0, 0, 0.06)",
    "lg": "0 10px 15px -3px rgba(0, 0, 0, 0.1), 0 4px 6px -2px rgba(0, 0, 0, 0.05)",
    "xl": "0 20px 25px -5px rgba(0, 0, 0, 0.1), 0 10px 10px -5px rgba(0, 0, 0, 0.04)",
    "inner": "inset 0 2px 4px 0 rgba(0, 0, 0, 0.06)",
    "artistic": "0 14px 28px rgba(0, 0, 0, 0.25), 0 10px 10px rgba(0, 0, 0, 0.22)"
  }
}
